{
  "$schema": "https://json-schema.org/draft/2020-12/schema",
  "type": "object",
  "required": ["schema_version", "name", "packs", "commands"],
  "properties": {
    "schema_version": {"const": 1},
    "name": {"type": "string"},
    "packs": {"type": "array", "items": {"type": "string"}},
    "commands": {"type": "object"}
  },
  "additionalProperties": false
}
