{
  "schema_version": 1,
  "name": "kernel",
  "packs": [
    "universal.authoring",
    "language.zig",
    "language.typescript",
    "language.javascript",
    "language.rust",
    "language.python",
    "language.shell",
    "language.mdx",
    "domain.sql",
    "domain.http",
    "domain.auth",
    "domain.documentation",
    "domain.changelog",
    "workflow.specifications"
  ],
  "commands": {
    "conform": [
      [
        "sh",
        "-c",
        "echo 'orly: no conform command configured yet — set commands.conform in your profile' >&2; exit 1"
      ]
    ]
  }
}
