{
  "schema_version": 1,
  "name": "dotfiles",
  "packs": [
    "universal.authoring",
    "language.zig",
    "language.typescript",
    "language.javascript",
    "language.rust",
    "language.python",
    "language.shell",
    "language.mdx",
    "domain.sql",
    "domain.http",
    "domain.auth",
    "domain.documentation",
    "domain.changelog",
    "domain.architecture",
    "workflow.specifications",
    "workflow.governance",
    "product.agentsfleet"
  ],
  "commands": {
    "conform": [["make", "audit"]],
    "verify.unit": [["python3", "-m", "unittest", "discover", "-s", "oracle-rules/tests", "-p", "test_*.py"]]
  }
}
